{
  "id": "antissepticos",
  "name": "Antissépticos",
  "icon": "🧴",
  "description": "Substâncias químicas para redução da carga microbiana na pele e mucosas.",
  "category": "Produtos para Saúde",
  "subcategory": "Antissépticos",
  "tags": [
    "antisseptico",
    "desinfetante",
    "antisepsia",
    "higienização",
    "enfermagem"
  ],
  "catalog": {
    "manufacturers": [
      "Rioquímica",
      "Asseptgel",
      "Vic Pharma",
      "Ecolab",
      "Johnson & Johnson"
    ],
    "models": [
      "Clorexidina 2%",
      "Clorexidina 4%",
      "Povidine-iodo",
      "Álcool 70%",
      "Clorhexidina + álcool"
    ],
    "productCodes": [
      "ANT-CLX-001",
      "ANT-PVI-002",
      "ANT-ALC-003"
    ],
    "registration": "ANVISA 1034.501-12",
    "technicalDocs": [
      "/pdfs/ficha-tecnica-antissepticos.pdf"
    ]
  },
  "semantic": {
    "snomed": "48396000",
    "loinc": [],
    "deviceCategory": "Antiseptic Agent",
    "clinicalDomain": [
      "Enfermagem",
      "Infecção Hospitalar",
      "Dermatologia"
    ],
    "fhirMapping": {
      "resource": "Device",
      "codeSystem": "SNOMED CT"
    }
  },
  "regulatory": {
    "anvisa": "Produto para saúde / Saneante",
    "fda": "21 CFR 310.545",
    "eu": "Biocidas Regulation (EU) 528/2012",
    "iso": []
  },
  "risk": {
    "anvisaClass": "III",
    "fdaClass": "OTC Monograph",
    "level": "Moderado",
    "rationale": "Aplicação em pele e mucosas, risco de irritação, sensibilização e toxicidade sistêmica em recém-nascidos."
  },
  "exclusiveModules": [
    "espectro",
    "tempoAcao",
    "concentracao",
    "incompatibilidades",
    "areaAplicacao"
  ],
  "characteristics": {
    "espectro": {
      "clorexidina": "Amplissimo espectro: Gram+, Gram-, fungos, vírus lipídicos",
      "povidine": "Amplo: Gram+, Gram-, fungos, vírus, micobactérias",
      "alcool": "Bactericida e virucida para vírus lipídicos, não age contra esporos",
      "triclosan": "Bactericida para Gram+, algumas Gram-"
    },
    "tempoAcao": {
      "clorexidina": "Efeito residual até 6-12h (degermante) e 48h (degermante 4%)",
      "povidine": "30 segundos a 1 minuto para ação rápida",
      "alcool": "30 segundos a 1 minuto (evaporação rápida)",
      "aguaOxigenada": "5 minutos para ação esporicida"
    },
    "concentracao": {
      "clorexidina": "0.5% (mucosas), 2% (pele), 4% (degermante)",
      "povidine": "1% (equivalente a 0.1% iodo livre), 10% (equivalente a 1% iodo livre)",
      "alcool": "70% (p/v) — concentração ideal; acima de 90% menos eficaz",
      "tanino": "1-2% para antisepsia"
    },
    "incompatibilidades": {
      "clorexidina": [
        "Sabões aniônicos",
        "Cloretos",
        "Mucopolisacarídeos",
        "Álcool em mucosas (irritação)",
        "Tampão fosfato"
      ],
      "povidine": [
        "Mercúrio",
        "Prata",
        "Ácido tânico",
        "Bases suaves",
        "Parafina"
      ],
      "alcool": [
        "Clorexidina (precipitação)",
        "Material volátil"
      ]
    },
    "areaAplicacao": {
      "preoperatoria": "Clorexidina 2% ou Povidine 10% (pele intacta)",
      "mucosas": "Clorexidina 0.5% ou Povidine 1% (diluído)",
      "neonatalogia": "Clorexidina 0.5% SEM álcool (risco de queimadura)",
      "higienizacao": "Clorexidina 2-4% ou sabonete comum"
    }
  },
  "clinicalKnowledge": {
    "clinicalPurpose": {
      "primary": "Reduzir a carga microbiana na pele antes de procedimentos invasivos",
      "secondary": [
        "Prevenir infecções de sitio cirúrgico",
        "Prevenir infecção de corrente sanguínea"
      ]
    },
    "indications": [
      {
        "condition": "Antisepsia cirúrgica de pele",
        "recommended": true,
        "rationale": "Redução de flora cutânea transitória e residente"
      },
      {
        "condition": "Higienização das mãos",
        "recommended": true,
        "rationale": "Prevenção de transmissão cruzada"
      },
      {
        "condition": "Cuidado de cateteres",
        "recommended": true,
        "rationale": "Prevenção de IPCSL e infecção de cateter"
      }
    ],
    "contraindications": [
      {
        "condition": "Alergia conhecida ao componente",
        "risk": "Reação alérgica grave (especialmente iodóforos e clorexidina)"
      },
      {
        "condition": "Uso em recém-nascidos < 2.500g ou prematuros",
        "risk": "Queimadura química com clorexidina alcoólica"
      },
      {
        "condition": "Aplicação em mucosas com solução alcoólica",
        "risk": "Irritação e dor intensa"
      }
    ],
    "clinicalRisks": [
      {
        "risk": "Reação alérgica de contato",
        "severity": "Moderada",
        "prevention": "Verificar história de alergia antes da aplicação"
      },
      {
        "risk": "Queimadura química neonatal",
        "severity": "Alta",
        "prevention": "Usar clorexidina sem álcool em RN"
      }
    ],
    "evidence": {
      "level": "Alta",
      "types": [
        "Revisão sistemática",
        "Diretriz CDC",
        "WHO"
      ],
      "lastUpdated": "2026-06-01",
      "reviewResponsible": "CKO Infection Control Team"
    }
  },
  "nursingIntelligence": {
    "nursingProcess": {
      "assessment": [
        "Integridade da pele",
        "Alergias conhecidas",
        "Área a ser tratada"
      ],
      "diagnosis": [
        {
          "nanda": "00004",
          "label": "Risco de infecção"
        }
      ],
      "interventions": [
        {
          "nic": "6550",
          "label": "Protetores de isolamento"
        }
      ],
      "outcomes": [
        {
          "noc": "0703",
          "label": "Severidade da infecção"
        }
      ]
    }
  },
  "decisionIntelligence": {
    "decisionSupport": {
      "whenToUse": [
        {
          "condition": "Antisepsia de pele íntegra pré-operatória",
          "recommendation": "Clorexidina 2% ou Povidine 10%."
        },
        {
          "condition": "Antisepsia de mucosas",
          "recommendation": "Clorexidina 0.5% aquosa ou Povidine 1%."
        },
        {
          "condition": "Higienização das mãos",
          "recommendation": "Álcool 70% gel ou clorexidina degermante."
        }
      ],
      "whenToAvoid": [
        "Álcool em mucosas ou pele não íntegra",
        "Clorexidina alcoólica em neonatos",
        "Povidine em pacientes com alergia ao iodo"
      ],
      "decisionMatrix": [
        {
          "clinicalScenario": "Antisepsia pré-operatória de paciente adulto",
          "recommendedDevice": "Clorexidina 2% em solução alcoólica 70%",
          "reason": "Maior efeito residual e eficácia contra Gram-positivos",
          "evidenceLevel": "Alta"
        },
        {
          "clinicalScenario": "Paciente com alergia ao iodo",
          "recommendedDevice": "Clorexidina 2% aquosa",
          "reason": "Alternativa eficaz sem risco de reação alérgica",
          "evidenceLevel": "Moderada"
        },
        {
          "clinicalScenario": "RN prematuro < 32 semanas",
          "recommendedDevice": "Clorexidina 0.5% aquosa",
          "reason": "Segurança: evitar queimadura química",
          "evidenceLevel": "Alta"
        }
      ]
    },
    "clinicalAlerts": [
      {
        "trigger": {
          "condition": "Recém-nascido < 2.500g ou prematuro",
          "device": "Clorexidina alcoólica"
        },
        "alert": {
          "level": "Alta",
          "message": "Risco de queimadura química. Usar clorexidina aquosa ou solução sem álcool."
        },
        "action": [
          "Selecionar formulação adequada",
          "Comunicar equipe",
          "Documentar em prontuário"
        ]
      },
      {
        "trigger": {
          "condition": "Paciente com reação alérgica previa a antisséptico",
          "device": "Qualquer"
        },
        "alert": {
          "level": "Alta",
          "message": "Documentar alergia e usar alternativa segura."
        },
        "action": [
          "Registrar alergia",
          "Selecionar alternativa",
          "Comunicar equipe"
        ]
      }
    ]
  },
  "comparisonEngine": {
    "dimensions": [
      {
        "name": "Espectro",
        "type": "string"
      },
      {
        "name": "Efeito residual",
        "type": "string"
      },
      {
        "name": "Concentração",
        "type": "string"
      }
    ],
    "compare": [
      {
        "device": "Clorexidina 2%",
        "values": {
          "Espectro": "Amplíssimo",
          "Efeito residual": "6-12h",
          "Concentração": "2%"
        }
      },
      {
        "device": "Povidine 10%",
        "values": {
          "Espectro": "Amplo",
          "Efeito residual": "Curto",
          "Concentração": "10%"
        }
      },
      {
        "device": "Álcool 70%",
        "values": {
          "Espectro": "Bactericida",
          "Efeito residual": "Nenhum",
          "Concentração": "70%"
        }
      }
    ]
  },
  "patientSafety": {
    "highRisk": false,
    "doubleCheckRequired": false,
    "neverEvents": [
      "Aplicar clorexidina alcoólica em RN",
      "Misturar antissépticos incompatíveis"
    ],
    "alerts": [
      {
        "type": "Alergia",
        "message": "Verificar alergias antes da aplicação. Registrar reações anteriores."
      },
      {
        "type": "Queimadura neonatal",
        "message": "Clorexidina sem álcool para RN de baixo peso."
      }
    ]
  },
  "sustainability": {
    "reusable": false,
    "material": [
      "Solução aquosa/alcoólica"
    ],
    "disposalClass": "Resíduo químico (diluições em pia)",
    "environmentalImpact": "Liberação de compostos fenólicos e iodo em efluentes hospitalares.",
    "sustainableAlternatives": [
      "Uso de dispensadores fechados para reduzir desperdício",
      "Diluições corretas para evitar excesso"
    ]
  },
  "education": {
    "curriculumMapping": {
      "level": "Básico",
      "competencies": [
        "Seleção do antisséptico correto",